{
  "_meta": {
    "version": "0.1",
    "purpose": "Hand-curated ground truth: every part carries a real source, a dated price band, and a measurement confidence. This file is the moat. Never let an LLM generate values in here.",
    "confidence_legend": {
      "datasheet": "value taken verbatim from manufacturer datasheet",
      "measured": "value measured on the physical SKU you will link in the store (caliper, 3 samples)",
      "clone-typical": "value copied from a visually identical clone - MUST be re-measured before it is trusted"
    },
    "datum_convention": "Every part's hole coordinates and keepouts are relative to the SAME datum: the bottom-left corner of the body bounding box, X to the right, Y away from the viewer, Z up. Do not mix conventions.",
    "required_fields_per_part": [
      "id, name, source_url, price_idr_min, price_idr_max, price_date",
      "logic_v, supply_v_min, supply_v_max",
      "current_idle_ma, current_peak_ma",
      "iface.type, iface.pins[], iface.i2c_addr_default, iface.i2c_addr_options[]",
      "dims.w_mm, dims.d_mm, dims.h_mm, dims.shape_class, dims.tolerance_mm",
      "mount.holes[] {x_mm, y_mm, dia_mm}, mount.standoff_mm, mount.header_pitch_mm",
      "keepouts[] {side, w_mm, d_mm}",
      "needs_level_shift, needs_external_supply, needs_flyback",
      "confidence, notes"
    ]
  },
  "boards": [
    {
      "id": "esp32-devkitc-v4",
      "name": "ESP32 DevKitC V4 (ESP32-WROOM-32, 30-pin)",
      "logic_v": 3.3,
      "pins": {
        "input_only": [
          34,
          35,
          36,
          37,
          38,
          39
        ],
        "flash_reserved": [
          6,
          7,
          8,
          9,
          10,
          11
        ],
        "strapping": [
          0,
          2,
          5,
          12,
          15
        ],
        "usb_native": [
          19,
          20
        ],
        "uart0": [
          1,
          3
        ],
        "boot": [
          0
        ],
        "adc1": [
          32,
          33,
          34,
          35,
          36,
          39
        ],
        "adc2": [
          0,
          2,
          4,
          12,
          13,
          14,
          15,
          25,
          26,
          27
        ],
        "dac": [
          25,
          26
        ],
        "touch": [
          4,
          13,
          14,
          15,
          27,
          32,
          33
        ],
        "pwm_ledc": [
          2,
          4,
          5,
          12,
          13,
          14,
          15,
          16,
          17,
          18,
          19,
          21,
          22,
          23,
          25,
          26,
          27,
          32,
          33
        ],
        "i2c_default": {
          "sda": 21,
          "scl": 22
        },
        "spi_vspi": {
          "sck": 18,
          "miso": 19,
          "mosi": 23,
          "ss": 5
        }
      },
      "rails": {
        "3v3": {
          "source": "AMS1117 from VIN",
          "recommended_max_ma": 300,
          "absolute_max_ma": 500
        },
        "5v_vin": {
          "source": "USB or barrel jack",
          "recommended_max_ma": 500
        },
        "note": "WiFi TX bursts pull ~240 mA on 3V3. Budget for it before adding anything else."
      },
      "dims": {
        "w_mm": 52.4,
        "d_mm": 27.9,
        "h_mm": 13.2,
        "tolerance_mm": 0.5,
        "shape_class": "rect",
        "confidence": "datasheet"
      }
    }
  ],
  "parts": [
    {
      "id": "hc-sr04",
      "name": "HC-SR04 ultrasonic distance",
      "category": "sensor",
      "source_url": "TODO: tokopedia + amazon listing (the exact SKU you will sell)",
      "price_idr_min": 9000,
      "price_idr_max": 25000,
      "price_date": "2026-10-25",
      "logic_v": 5.0,
      "supply_v_min": 5.0,
      "supply_v_max": 5.5,
      "current_idle_ma": 2,
      "current_peak_ma": 15,
      "iface": {
        "type": "digital",
        "pins": [
          "VCC",
          "TRIG",
          "ECHO",
          "GND"
        ],
        "i2c_addr_default": null,
        "i2c_addr_options": []
      },
      "needs_level_shift": true,
      "needs_external_supply": false,
      "needs_flyback": false,
      "dims": {
        "w_mm": 45.0,
        "d_mm": 20.0,
        "h_mm": 15.0,
        "shape_class": "rect",
        "tolerance_mm": 1.0,
        "confidence": "clone-typical"
      },
      "mount": {
        "holes": [],
        "standoff_mm": 0,
        "header_pitch_mm": 2.54,
        "hole_note": "4 x dia 2.5 mm, pattern approx 43.5 x 18.5 mm - MEASURE"
      },
      "keepouts": [
        {
          "side": "front",
          "w_mm": 14.0,
          "d_mm": 20.0
        }
      ],
      "notes": "ECHO idles at 5 V -> level shifter or divider REQUIRED (rule R10). Transducer face must stay clear of enclosure wall.",
      "confidence": "clone-typical"
    },
    {
      "id": "dht22",
      "name": "DHT22 temperature/humidity",
      "category": "sensor",
      "source_url": "TODO",
      "price_idr_min": 25000,
      "price_idr_max": 60000,
      "price_date": "2026-10-25",
      "logic_v": 3.3,
      "supply_v_min": 3.3,
      "supply_v_max": 6.0,
      "current_idle_ma": 0.3,
      "current_peak_ma": 2.5,
      "iface": {
        "type": "digital",
        "pins": [
          "VCC",
          "DATA",
          "NC",
          "GND"
        ],
        "i2c_addr_default": null,
        "i2c_addr_options": []
      },
      "needs_level_shift": false,
      "needs_external_supply": false,
      "needs_flyback": false,
      "dims": {
        "w_mm": 25.4,
        "d_mm": 27.7,
        "h_mm": 15.2,
        "shape_class": "rect",
        "tolerance_mm": 0.5,
        "confidence": "clone-typical"
      },
      "mount": {
        "holes": [],
        "standoff_mm": 0,
        "header_pitch_mm": 2.54,
        "hole_note": "bare sensor has NO holes - needs a clip or clamp; breakout version differs"
      },
      "keepouts": [
        {
          "side": "front",
          "w_mm": 25.4,
          "d_mm": 15.0
        }
      ],
      "notes": "Add 4.7k-10k pull-up on DATA. Slower sampling (min 2 s). Vented case must stay open to air.",
      "confidence": "clone-typical"
    },
    {
      "id": "ssd1306-096",
      "name": "0.96in SSD1306 OLED, I2C, 128x64",
      "category": "display",
      "source_url": "TODO",
      "price_idr_min": 12000,
      "price_idr_max": 35000,
      "price_date": "2026-10-25",
      "logic_v": 3.3,
      "supply_v_min": 3.0,
      "supply_v_max": 5.5,
      "current_idle_ma": 10,
      "current_peak_ma": 20,
      "iface": {
        "type": "i2c",
        "pins": [
          "GND",
          "VCC",
          "SCL",
          "SDA"
        ],
        "i2c_addr_default": "0x3C",
        "i2c_addr_options": [
          "0x3D"
        ]
      },
      "needs_level_shift": false,
      "needs_external_supply": false,
      "needs_flyback": false,
      "dims": {
        "w_mm": 27.3,
        "d_mm": 27.8,
        "h_mm": 4.1,
        "shape_class": "rect",
        "tolerance_mm": 0.5,
        "confidence": "clone-typical"
      },
      "mount": {
        "holes": [],
        "standoff_mm": 0,
        "header_pitch_mm": 2.54,
        "hole_note": "4 x dia 2.0 mm, pattern approx 23.5 x 23.5 mm - MEASURE"
      },
      "keepouts": [
        {
          "side": "top",
          "w_mm": 27.3,
          "d_mm": 27.8
        }
      ],
      "notes": "Address strap 0x3C/0x3D - the single most common collision in beginner builds (rule R8). Screen side is glass - keep glass clear of enclosure walls.",
      "confidence": "clone-typical"
    },
    {
      "id": "sg90",
      "name": "SG90 micro servo",
      "category": "actuator",
      "source_url": "TODO",
      "price_idr_min": 15000,
      "price_idr_max": 35000,
      "price_date": "2026-10-25",
      "logic_v": 5.0,
      "supply_v_min": 4.8,
      "supply_v_max": 6.0,
      "current_idle_ma": 10,
      "current_peak_ma": 250,
      "iface": {
        "type": "pwm",
        "pins": [
          "GND",
          "VCC",
          "SIG"
        ],
        "i2c_addr_default": null,
        "i2c_addr_options": []
      },
      "needs_level_shift": false,
      "needs_external_supply": true,
      "needs_flyback": false,
      "dims": {
        "w_mm": 40.7,
        "d_mm": 12.2,
        "h_mm": 35.5,
        "shape_class": "rect",
        "tolerance_mm": 1.0,
        "confidence": "clone-typical"
      },
      "mount": {
        "holes": [],
        "standoff_mm": 0,
        "header_pitch_mm": 2.54,
        "hole_note": "2 ears, dia 4.2-4.8 mm, spacing approx 28 x 10 mm - MEASURE"
      },
      "keepouts": [
        {
          "side": "top",
          "w_mm": 40.7,
          "d_mm": 35.5
        }
      ],
      "notes": "Stall ~250 mA. MUST NOT be powered from the 3V3 rail (rules R11/R12). Signal from ESP32 3.3 V is accepted by most servos.",
      "confidence": "clone-typical"
    },
    {
      "id": "mg996r",
      "name": "MG996R metal gear servo",
      "category": "actuator",
      "source_url": "TODO",
      "price_idr_min": 35000,
      "price_idr_max": 80000,
      "price_date": "2026-10-25",
      "logic_v": 5.0,
      "supply_v_min": 4.8,
      "supply_v_max": 7.4,
      "current_idle_ma": 20,
      "current_peak_ma": 1200,
      "iface": {
        "type": "pwm",
        "pins": [
          "GND",
          "VCC",
          "SIG"
        ],
        "i2c_addr_default": null,
        "i2c_addr_options": []
      },
      "needs_level_shift": false,
      "needs_external_supply": true,
      "needs_flyback": false,
      "dims": {
        "w_mm": 40.7,
        "d_mm": 19.7,
        "h_mm": 42.9,
        "shape_class": "rect",
        "tolerance_mm": 1.0,
        "confidence": "clone-typical"
      },
      "mount": {
        "holes": [],
        "standoff_mm": 0,
        "header_pitch_mm": 2.54,